,questions,answers
0, What big data services does Cazton offer?,"Cazton has been a pioneer in Big Data. Our team includes but not limited to Big Data Engineers, Distributed Systems Engineer, Data Scientists, Hadoop Experts, Spark Experts, Spark.NET Experts, Kafka Experts have years of experience and strong analytical and problem-solving skills. Our experts have hands-on experience with Big Data technologies that includes Hadoop, Spark, HIVE, HBase, Kafka, Impala, PIG, Zookeeper, Cassandra. NoSQL databases like Couchbase, MongoDB and have proven record building solid production level software on various Big data technologies. Contact us now to learn more about our big data services."
1, What strategies can companies use to better understand large amounts of data?,"
With every passing second, the amount of data shared and transferred between humans is unimaginable. To manage, analyze, make predictions and decisions using that data is a daunting task. With data being a critical asset, companies today strive to understand the latest market trends, customer preferences and other requirements, thus making understanding large amount of data imperative.
"
2, What features does Microsoft Fabric offer as part of its modern analytics platform?,"
Microsoft Fabric offers a comprehensive and streamlined solution that caters to diverse analytics workloads and users, all built upon a robust data foundation designed for enterprise-grade performance. It seamlessly combines Power BI, Data Factory, and the cutting-edge iteration of Synapse, presenting a unified software-as-a-service (SaaS) solution. This innovative offering empowers customers with a cost-efficient and effortlessly administered modern analytics platform, specifically tailored to meet the demands of the AI-driven era.
"
3,"
What advantages does Spark offer over Hadoop's MapReduce system?","
Spark is an open-source, lightning fast, cluster computing framework that provides a fast and powerful engine for large-scale data (Big Data) processing. It runs programs up to 100x faster in-memory and 10x faster on disk when compared to Hadoop’s MapReduce system. The reason for Spark’s success is its ability to process data in-memory (using RAM) that allows faster retrieval of data as compared to querying and searching on disk.
"
4, What was Databricks' annualized revenue two years ago?,"
On Aug 5, 2022, the CEO of Databricks announced Friday that his company has surpassed $1 billion in annualized revenue. This is more than double the $350 million in annualized revenue it reported just two years ago. This clearly rivals Snowflake’s growth and paves way for Databricks’ much-anticipated IPO in the near future.
"
5, What are the advantages of using Apache™ Hadoop for Big Data processing and storage?,"
Cazton has been a pioneer in Big Data Consulting and one popular technology that powers Big Data is Apache™ Hadoop. Hadoop is a highly scalable open-source framework written in Java, which allows processing and storage of terabytes or even petabytes of structured and unstructured complex data (Big Data) across clusters of computers. Its unique storage mechanism over distributed file system (HDFS) maps data wherever it is located on a cluster. The speciality of Hadoop is that it can scale from one server to hundreds of servers and can still perform well. It is fast, flexible and cost-effective as compared to traditional storage systems.
"
6,"
What are the advantages of having real-time insights into active transactions?","
Imagine a process which converts unstructured, unreadable pieces of information into something that is extremely valuable for your organization? information that gives you insights about your business, your products, customers and their preferences. Now imagine getting those insights in real time! We are talking about a process that gives you instant information about an active transaction. Such information is always valuable, isn't it
"
7,"
What advantages does Spark offer for large scale data processing and Big Data analytics?","
Over the years, Spark has seen great acceptance in the technology industry. When it comes to large scale data processing or Big Data analytics, Spark has gained a lot of attention due to its lightning fast processing speed, batch and stream data processing, support for a variety of data sources and easy to integrate with applications written in C#, Java, Scala, Python and R.
"
8, What are the new features of Cosmos DB that make it different from previous generations of database technology?,"
The evolution of database technologies has been exceptional. Right from the first pre-stage flat-file systems to relational and object-relational databases to NoSQL databases, database technology has gone through several generations and its history has spread over more than 50 years now. A time has come when database technology has taken the next step forward to become more scalable, globally distributed and multi-model. Welcome to the new world of Cosmos DB!
"
9, What are some of the largest production deployments of Cassandra?,"
Did you know there are more than 1500 companies using Cassandra to handle huge volumes of data? Did you know that some of the largest production deployments include Apple's, with over 75,000 nodes storing over 10 PB of data, Netflix (2,500 nodes, 420 TB, over 1 trillion requests per day), Chinese search engine Easou (270 nodes, 300 TB, over 800 million requests per day), and eBay (over 100 nodes, 250 TB)?
"
10, What are the different types of data models that have emerged throughout the history of databases?,"
Database technologies have undergone several generations of evolution, right from flat-file systems to relational databases to schemaless databases. Some people might say that traditional relational databases are a thing of the past, but that is not true for all the scenarios. Changing requirements and evolution of the internet has meant that new types of databases have emerged, but most have specific use cases, which makes it difficult to decide on which database should be used when. At the same time, different types of data models have emerged throughout the history of databases but only Relational and NoSQL models have prevailed.
"
11, What are the different types of NoSQL databases available?,"
Did you know relational databases can scale up, but have a hard time scaling out? NoSQL databases, on the other hand, are meant to scale out with commodity-grade hardware. Many organizations prefer using NoSQL over SQL databases as it offers a great set of features. There are different types of NoSQL databases available including Key-Value Store, Document Databases, Column-Family Databases, Graph Databases and Full-Text Search Engine Databases.
"
12, What type of caching strategy do you need that will scale seamlessly with the least amount of effort?,"
Do you have a good caching strategy for your applications? Have you felt the pain of sticky sessions? Have you had a caching strategy that didn't work for you? Do you need a caching strategy that scales seamlessly with the least amount of effort? If the answer to any of these questions is a ""yes,"" the good news is that you are in the right place.
"
13, What measures do you take to increase the speed of data processing and machine learning model training?,"
Do you face problems while scaling data in memory? Are you facing slow processing times? Do you want scalability and as well as atomic transactions? Do your machine learning models require a lot of time for training and production?
"
14, What challenges have you faced while working with SQL Server code that involves large amounts of data?,"
Have you ever encountered SQL Server code with more than 50 joins in a query? Have you ever seen code that retrieves millions of records SQL Server to the Web Server just to return one record to the User Interface? If yes, that's great. This is our daily job.
"
15, What research studies have consistently ranked PostGres as one of the top four relational databases?,"
Did you know PostGres is the fastest growing relational database that is not only free and open source, but rivals the performance of paid RDBMS databases like Oracle and SQL Server? It is no surprise that PostGres has consistently ranked as one of the top four relational databases by multiple credible research studies comparing database engines.
"
16, How does a robust search contribute to increased customer traffic and growth in sales?,"
Search is one of the most important aspects in any application. Could you imagine Amazon, one of the world's largest e-commerce websites, without a search functionality? It would be nearly impossible to find products if we had to look for them manually. A robust search in this case is the key towards best user experience, increased customer traffic, growth in sales and generation of customer data, which is invaluable for such a big organization.
"
17, What advantages does Elasticsearch provide compared to traditional RDBMS?,"
Search is one of the most important tools in any web application. Having a robust and fool-proof search system can boost your business growth in many ways. One such technology that empowers search is called Elasticsearch. Unlike traditional RDBMS, Elasticsearch is designed to allow full-text searching. It allows you to create your own search-engine that is fast, powerful and scalable. In addition to web searches, Elasticsearch is also used for log analysis and big data analytics.
"
18, What services does Cazton offer related to Artificial Intelligence?,"Cazton offers consulting, recruiting and training services for Machine Learning, Deep Learning, Data Science, Artificial Intelligence and much more. Our team is composed of experienced Machine Learning Engineers, Data Scientists, Research Scientists, R&D Engineers, Distributed Systems Engineer, Business Intelligence Developers, Computer Vision Engineers, AI Experts who can provide you services at a cost effective rate. Contact us now to learn more about our artificial intelligence services."
19, What benefits does Cazton's AI Express PoC service provide for businesses?,"
'AI Express PoC' is a one-week OpenAI PoC service offered by Cazton that allows businesses to quickly develop and test AI solutions. This service is designed to help companies rapidly explore the potential of AI technologies and determine whether they are a good fit for their specific needs and objectives. With the fast-paced nature of the tech industry, being able to quickly evaluate the feasibility of AI applications is essential to staying competitive. 
"
20,"
What challenges exist in the realm of artificial intelligence with autonomous agents powered by Large Language Models (LLMs)?","
The realm of artificial intelligence has birthed a transformative evolution: autonomous agents powered by Large Language Models (LLMs). These agents transcend mere text generation, becoming problem-solving entities. From intricate planning strategies to memory utilization and ecosystem navigation, they mirror human-like problem-solving. This exploration navigates their capabilities, showcasing their potential through case studies like scientific discovery, generative simulations, collaborative robotics, and smart city management. However, challenges persist, from finite context lengths to ethical concerns and security issues. As the horizon expands for these agents, considerations arise for implementing them, and Cazton offers expertise in crafting tailored solutions. The journey toward fully autonomous agents brims with challenges yet promises a future where these intelligent entities redefine our interaction with technology and the world.
"
21, What are some of the advantages of using large language models for natural language processing tasks?,"
Imagine being able to build almost any digital asset just by providing prompts in natural language. Language models (LMs) like T5, LaMDA, GPT-3, and PaLM have demonstrated impressive performance on such tasks. Recent studies suggest that scaling up the size of the model is crucial for solving complex natural language problems.
"
22,"
What are some of the ways OpenAI is transforming the world?","
OpenAI is transforming the world through its groundbreaking advancements in artificial intelligence and language processing technologies. It is transforming the world by providing accessible AI technology that enables businesses and developers to leverage advanced language models. It automates tasks, improves efficiency, and fosters innovation across industries. With its natural language processing capabilities, it enables personalized experiences, augmented decision-making, and improved user interfaces.
"
23, What advantages does Spark offer compared to Hadoop's MapReduce?,"
Spark is an open-source, lightning fast, cluster computing framework that provides a fast and powerful engine for large-scale data (Big Data) processing. It runs programs up to 100x faster in-memory and 10x faster on disk when compared to Hadoop’s MapReduce system. The reason for Spark’s success is its ability to process data in-memory (using RAM) that allows faster retrieval of data as compared to querying and searching on disk.
"
24,"
What are the remarkable capabilities of Azure OpenAI?","
Azure OpenAI is a groundbreaking service that integrates OpenAI's advanced language models with Microsoft Azure, offering seamless REST API access for AI-driven solutions. Cazton's CEO delivered insightful keynotes at the Global AI Developer Days in Fall 2022, spanning Europe, the United States, and Latin America. Dive into Cazton's captivating video demo and witness the remarkable capabilities of Azure OpenAI, effortlessly generating charts and images with a single response. Transform your business with AI-driven solutions today!
"
25, What are the advantages of using Spark for large scale data processing and Big Data analytics?,"
Over the years, Spark has seen great acceptance in the technology industry. When it comes to large scale data processing or Big Data analytics, Spark has gained a lot of attention due to its lightning fast processing speed, batch and stream data processing, support for a variety of data sources and easy to integrate with applications written in C#, Java, Scala, Python and R.
"
26, How does the Cazton team help create a secure and customizable model?,"
Cazton team has solved all the major challenges and can help you create a fully customizable model that is secure, keeps data private, platform agnostic, integrates with existing systems, allows frequent granular model updates and trains even on extremely small data.
"
27, What are the challenges faced by companies in understanding large amounts of data?,"
With every passing second, the amount of data shared and transferred between humans is unimaginable. To manage, analyze, make predictions and decisions using that data is a daunting task. With data being a critical asset, companies today strive to understand the latest market trends, customer preferences and other requirements, thus making understanding large amount of data imperative.
"
28," What factors contribute to the high failure rate of tech projects, and how can businesses mitigate those risks?","
In today's rapidly evolving tech landscape, the success rate of technical projects, including AI ones, remains disappointingly low. Many companies embark on ambitious tech ventures, only to see them fail due to a variety of reasons. This high failure rate presents a significant challenge for businesses looking to capitalize on the potential of digital modernization, such as artificial intelligence.
"
29, What are the benefits of having real-time insights into active transactions?,"
Imagine a process which converts unstructured, unreadable pieces of information into something that is extremely valuable for your organization? information that gives you insights about your business, your products, customers and their preferences. Now imagine getting those insights in real time! We are talking about a process that gives you instant information about an active transaction. Such information is always valuable, isn't it
"
30,"
What are the major use cases of PyTorch?","
PyTorch is one of the most popular deep learning frameworks and is based on the library Torch. Computer vision and natural language processing are two major use cases. When it was launched, it was easier to use with Graphics Processing Units (GPUs) and that explains why researchers preferred it over competitive offerings like TensorFlow.
"
31, What are the different generations of database technologies and data models?,"
Database technologies have undergone several generations of evolution, right from flat-file systems to relational databases to schemaless databases. Some people might say that traditional relational databases are a thing of the past, but that is not true for all the scenarios. Changing requirements and evolution of the internet has meant that new types of databases have emerged, but most have specific use cases, which makes it difficult to decide on which database should be used when. At the same time, different types of data models have emerged throughout the history of databases but only Relational and NoSQL models have prevailed.
"
32, What degree does Chander Dhall have that has enabled him to stay up to date with machine learning?,"
Our CEO, Chander Dhall, became fascinated with machine learning over a decade ago. Having a masters in computer science, he has always kept up with academia even though the company primarily works on projects for mid and large size Fortune 500 corporations.
"
33, What are the different types of NoSQL databases available?,"
Did you know relational databases can scale up, but have a hard time scaling out? NoSQL databases, on the other hand, are meant to scale out with commodity-grade hardware. Many organizations prefer using NoSQL over SQL databases as it offers a great set of features. There are different types of NoSQL databases available including Key-Value Store, Document Databases, Column-Family Databases, Graph Databases and Full-Text Search Engine Databases.
"
34, What type of projects does the company primarily work on?,"
Our CEO, Chander Dhall, became fascinated with machine learning over a decade ago. Having a masters in computer science, he has always kept up with academia even though the company primarily works on projects for mid and large size Fortune 500 corporations. Having been awarded by both Microsoft (Microsoft Most Valuable Professional for close to a decade) and Google (Google Developer Expert), he has been fortunate to interact and share knowledge with the ones who create these technologies.
"
35, How many companies use Cassandra to handle large volumes of data?,"
Did you know there are more than 1500 companies using Cassandra to handle huge volumes of data? Did you know that some of the largest production deployments include Apple's, with over 75,000 nodes storing over 10 PB of data, Netflix (2,500 nodes, 420 TB, over 1 trillion requests per day), Chinese search engine Easou (270 nodes, 300 TB, over 800 million requests per day), and eBay (over 100 nodes, 250 TB)?
"
36, What are the advantages of using ChatGPT compared to other AI products?,"
ChatGPT is the fastest product in history to have acquired more than a million customers in just five days. Generative AI or GANs (Generative Adversarial Network) is a type of artificial intelligence that generates new content, such as text, images, or music, based on a set of input data.
"
37, What type of caching strategy do you need to ensure scalability with minimal effort?,"
Do you have a good caching strategy for your applications? Have you felt the pain of sticky sessions? Have you had a caching strategy that didn't work for you? Do you need a caching strategy that scales seamlessly with the least amount of effort? If the answer to any of these questions is a ""yes,"" the good news is that you are in the right place.
"
38," Are you looking for a solution that offers scalability, atomic transactions, and fast processing times for machine learning models?","
Do you face problems while scaling data in memory? Are you facing slow processing times? Do you want scalability and as well as atomic transactions? Do your machine learning models require a lot of time for training and production?
"
39, What advantages does Elasticsearch offer over traditional RDBMS systems?,"
Search is one of the most important tools in any web application. Having a robust and fool-proof search system can boost your business growth in many ways. One such technology that empowers search is called Elasticsearch. Unlike traditional RDBMS, Elasticsearch is designed to allow full-text searching. It allows you to create your own search-engine that is fast, powerful and scalable. In addition to web searches, Elasticsearch is also used for log analysis and big data analytics.
"
40, What are the benefits of a robust search in an e-commerce website?,"
Search is one of the most important aspects in any application. Could you imagine Amazon, one of the world's largest e-commerce websites, without a search functionality? It would be nearly impossible to find products if we had to look for them manually. A robust search in this case is the key towards best user experience, increased customer traffic, growth in sales and generation of customer data, which is invaluable for such a big organization.
"
41,What experience do your team members have with Microsoft and open source technologies?,"
Have you worked with multi-billion dollar consulting and recruiting companies? If yes, we are sure we can provide more quality services at a much more affordable rates. We have been fortunate to work directly with Microsoft product teams for many years. Our team includes Microsoft awarded Most Valuable Professionals, Azure Insiders, Docker Insiders, ASP.NET Insiders, Web API Advisors, Cosmos DB Insiders as well as experts in other Microsoft and notable open source technologies.
"
42, What services does Cazton offer in terms of web development?,"Cazton offers full stack development, devops and trainings on all the latest Microsoft and Non-Microsoft technologies. Our Microsoft practice is led by a Microsoft Most Valued Professional and comprised of former Microsoft employees, former IBMers and internationally-acclaimed speakers. Our Microsoft practice is heavily involved in open source projects and cloud based solutions, too. Our services cover technologies that includes but isn't limited to  .NET, .NET Core, Azure, SQL Server, Cosmos DB, ASP.NET, ASP.NET Core, Entity Framework, Docker and Kubernetes. Our experts can work on the latest JavaScript frameworks viz Angular, React, React Native, Vue, Node.js, Aurelia, AngularJS, BackboneJS, EmberJS, Polymer, Socket, Meteor and many more. Contact us now to learn more about our web development services."
43, What are the benefits of using .NET 7 to build applications?,"
.NET is a free, cross-platform, developer platform open-sourced by Microsoft. .NET 7 was released in November, 2022. It’s used to build web, mobile, desktop, games, IoT and other applications
"
44," What enhancements, optimizations, and fresh capabilities does .NET 8 offer?","
The software development realm is continuously evolving, and the advent of .NET 8, the latest long-term support (LTS) version, marks a significant milestone in this journey. Packed with a myriad of enhancements, optimizations, and fresh capabilities, this release represents a culmination of extensive refinements spanning performance, stability, security, and tooling. .NET 8 empowers developers to craft intelligent, cloud-native applications and services that effortlessly scale, underlining a leap forward in the landscape of software development.
"
45,"
What is the market share of Java according to the TIOBE Index in 2021?","
Java is a cross-platform, development framework open-sourced by Oracle. A survey conducted by the TIOBE Index in 2021 ranked Java as the second most popular programming language in the world, with a market share of 17.2% According to the 2021 Stack Overflow Developer Survey, Java is the third most popular programming language, with a popularity rating of 28.3%.
"
46, What is the purpose of .NET 6?,"
With the success of .NET 5, Microsoft has continued to build upon its unified vision and .NET 6 has replaced .NET Standard as a huge step towards becoming a truly multi-platform framework. .NET 6 unifies the SDK, runtime and base libraries as a single development platform and enables building apps for the cloud, web, desktop, mobile, gaming, IoT and artificial intelligence.
"
47, What advantages does Node.js offer compared to the .NET framework?,"
.NET framework was about a decade old when Node.js was launched. Node.js was created with an async-first vision with focus on efficiency and scalability. However, Node.js when introduced was single-threaded, it was not the best option for computation intensive jobs.
"
48, What advantages does .NET Core offer developers compared to the .NET Framework?,"
.NET Core is a fresh new software development framework that allows developers to create next generation apps with ease. It is Microsoft’s latest software development framework, which is cloud-enabled, cross-platform, modular and fast. It is a complete rewrite of the existing .NET framework. Unlike the .NET Framework, .NET Core is fully open-source, which means that the features of this framework directly reflect the skills and desires of .NET developers and the community.
"
