,questions,answers
611,What outcomes have clients achieved with Cosmos DB?,"Clients have achieved exceptional levels of performance and scalability with Cosmos DB, with write query latencies as low as 11ms and read query responses as low as 8ms."
612,What training content has Cazton developed for Azure Cosmos DB?,Cazton has developed training content for Azure Cosmos DB featured on Microsoft Channel 9.
613,What is the minimum write query latency achieved with Cosmos DB?,The minimum write query latency achieved with Cosmos DB is 11ms.
614,What is the minimum read query response time achieved with Cosmos DB?,The minimum read query response time achieved with Cosmos DB is 8ms.
615,Where was the CEO honored as an industry expert speaker?,The CEO was honored as an industry expert speaker at the Microsoft Visual Studio Launch Event.
616,What are the services provided by Cassandra Consulting?,"Cassandra Consulting provides a range of services including integrating Cassandra with other Big Data technologies, scaling Cassandra clusters, monitoring and managing Cassandra clusters, setting up Cassandra data models, working with third-party libraries and plugins, helping with application development, deploying Cassandra on-prem or on preferred cloud service, fixing database related issues, automating deployments, performing upgrading and data migration, mentoring teams, optimizing existing clusters, troubleshooting and fine-tuning performance, providing hardware recommendations, and offering custom Cassandra training."
617,How does Cassandra generate tokens?,"Cassandra generates tokens using a hashing function called Partitioners. Each row of data in Cassandra is uniquely identified by a primary key, and the partitioner generates tokens for all the data. These tokens are divided into an equal range based on the number of nodes in a cluster."
618,What is the role of the Cassandra community?,The Cassandra community is a strong and vibrant community that works to make Cassandra better. It contributes to the development and improvement of Cassandra through collaboration and sharing of knowledge and resources.
619,How can developers query Cassandra?,"Developers can query Cassandra using the CQLSH command line shell, which provides a range of operations for interacting with Cassandra, including creating keyspaces, tables, and indexes, inserting data, and more."
620,What are the benefits of using Cassandra?,"Using Cassandra offers several benefits, including highly scalable systems with high performance, cost-effectiveness, integration with other Big Data technologies, ability to scale clusters to multiple data centers, monitoring and management of clusters, support for different data models and third-party libraries, application development with Cassandra as the database, deployment options on-prem or on preferred cloud service, fixing database related issues, automation of deployments, zero downtime upgrading and data migration, mentoring teams with best practices, optimization of existing clusters, troubleshooting and fine-tuning performance, hardware recommendations, and custom training from beginner to advanced level."
621,What is the significance of Cassandra Query Language (CQL)?,Cassandra Query Language (CQL) is the primary language used by developers to communicate with Cassandra. It provides a command line shell called CQLSH for querying Cassandra and performing various operations.
622,What services does Cazton offer for Spark Consulting?,"Cazton offers flexible arrangements to hire Spark experts for full-time, hourly, or contract-to-hire projects at competitive prices."
623,What types of data can be loaded into Spark using datasets?,"Users can load data into Spark using JSON, CSV, and Text files, as well as databases via JDBC."
624,Who has access to the source code of Spark.NET before the release?,Cazton's CEO had access to the source code of Spark.NET before the release.
625,What is MMLSpark and what problem does it address?,"MMLSpark is Microsoft Machine Learning library for Apache Spark, which is an open source library built on top of SparkML. It addresses difficulties faced by Data Scientists in low level operations like support for image processing and text."
626,What is Azure Databricks and what is it optimized for?,"Azure Databricks is a Spark based analytics platform optimized for Azure. It is a software-as-a-service (SaaS) that provides one-click setup-fully managed spark clusters, streamlined workflows, and an interactive workspace for easy collaboration between data scientists, data engineers, and business analysts."
627,What are the features of Azure Databricks?,Azure Databricks is optimized for Azure and provides built-in integration with Azure Blob.
628,What does Azure Databricks provide integration with?,"Azure Databricks provides features such as one-click setup-fully managed spark clusters, streamlined workflows, and an interactive workspace for easy collaboration between data scientists, data engineers, and business analysts. It also provides integration with Azure Blob."
629,What are the challenges in managing and deriving insights from diverse types of data?,Effectively managing and deriving insights from diverse types of data is a significant challenge in the world of Big Data.
630,How can organizations benefit from the convergence of Big Data and Artificial Intelligence?,"The convergence of Big Data and Artificial Intelligence is revolutionizing industries worldwide, enabling sectors such as healthcare, retail, finance, manufacturing, transportation, and energy to benefit from data-driven insights and intelligent systems."
631,What is the role of data analytics in unlocking valuable insights from Big Data?,Data analytics plays a crucial role in unlocking valuable insights from Big Data.
632,What advanced technologies are utilized by Cazton for data analytics?,"Cazton utilizes advanced technologies such as Tableau, Power BI, and QlikView for data analytics."
633,What techniques are used by Cazton to uncover patterns and correlations within large datasets?,"Cazton utilizes statistical techniques, data mining, and cutting-edge data visualization tools to uncover patterns and correlations within large datasets."
634,What services does Cazton offer in the realm of Big Data?,Cazton offers services in utilizing advanced technologies for data analytics and extracting valuable insights from Big Data.
635,What is the main purpose of Kafka?,"The main purpose of Kafka is to handle high volumes of data streams across multiple sources, making it a central component in managing data pipelines and real-time applications."
636,How can Cazton help with Kafka consulting services?,"Cazton can help with Kafka consulting services by providing expert guidance, best practices for stream management and processing, and experience in administrating Kafka platforms and managing Kafka clusters."
637,What are some of the tasks involved in Kafka consulting?,"Some tasks involved in Kafka consulting include implementing access control measures and encryption protocols for Kafka clusters, evaluating the health and performance of Kafka deployments, developing proof of concepts for specific business use cases, and conducting training sessions and workshops on Kafka fundamentals and best practices."
638,What is the architecture of Apache Kafka based on?,"The architecture of Apache Kafka is based on several core elements, including topics, partitions, producers, consumers, brokers, and ZooKeeper."
639,Why is it important to understand the core concepts of Kafka?,Understanding the core concepts of Kafka is important to grasp the inner workings of its robust framework and effectively utilize its capabilities.
640,What is the aim of Electron.js?,The aim of Electron.js is to provide reliable core functionality while also taking up less space and improving performance.
641,What are some features of Electron.js?,"Some features of Electron.js include no additional skills required, cross-platform development, and the ability to use HTML, CSS, and JavaScript."
642,What skills are required to shift from building web applications to desktop applications using Electron.js?,"The skill-set required to shift from building web applications to desktop applications using Electron.js remains the same for HTML, CSS, and JavaScript."
643,What is the advantage of using Electron.js for cross-platform development?,The advantage of using Electron.js for cross-platform development is that it allows for the development of desktop applications that can run on multiple machines.
644,What is the difference between desktop applications and web-based applications?,"Desktop applications are installed on a single user's machine and cannot run on multiple machines, while web-based applications can be accessed by multiple machines simultaneously."
645,How does Electron.js ensure reliability even if a browser gets replaced or broken?,"Electron.js ensures reliability by not depending on the number of tabs open or the browser being used, so the UI experience for the user remains the same."
646,Why is data security a concern in web-based applications?,Data security is a concern in web-based applications because there are greater chances of user data integrity being compromised due to the open community.
647,Why is programming different for web-based applications and desktop applications?,Programming is different for web-based applications and desktop applications because they have different requirements and functionalities.
648,How can Cazton help with Electron.js Consulting?,"Cazton can help with Electron.js Consulting by providing expertise in mastering the technology, optimizing performance, integrating with other technologies, and maximizing system efficiency."
649,What are the potential performance issues with Electron.js?,Potential performance issues with Electron.js include high memory usage if not implemented correctly.
650,What services does Cazton offer for Node.js?,"Cazton offers Node.js development, consulting, and training services at affordable rates."
651,What are some benefits of using Node.js?,"Some benefits of using Node.js include faster page loads, better user experience, and the ability to use JavaScript for both server-side and client-side development."
652,How does Node.js enable developers to use JavaScript for both server-side and client-side?,"Node.js relies on Google Chrome's V8 engine, allowing developers to use JavaScript for both server-side and client-side development."
653,How does Node.js execute code?,"Node.js executes code asynchronously using an event loop, which allows for non-blocking I/O operations."
654,What are some services that Cazton provides for Node.js development?,"Cazton provides services such as architectural and coding best practices, high-performance application development, application migration to Node.js, code reviews, and performance troubleshooting."
655,What is the event-driven architecture in Node.js?,"The event-driven architecture in Node.js allows developers to create, listen, and fire custom events."
656,What are some advantages of using Node.js?,"Advantages of using Node.js include non-blocking I/O execution, high performance, and the ability to leverage the power of the V8 engine."
657,What is NPM and what is its role in Node.js?,"NPM (Node Package Manager) is the default package manager for Node.js, used for installing and managing dependencies."
658,What is the V8 engine in Node.js?,The V8 engine in Node.js is responsible for compiling JavaScript code into machine code and optimizing garbage collection for memory management.
659,What is the default package manager for Node.js?,NPM is the default package manager for Node.js.
660,What is .NET Core?,".NET Core is an open-source, cloud-enabled, cross-platform software development framework which is a complete rewrite of the existing .NET Framework."
661,What are the features of .NET Core?,It focuses on agile and modular application development through its deep integration with NuGet packages.
662,How does .NET Core differ from the existing .NET Framework?,".NET Core differs from the existing .NET Framework by being open-source, cloud-enabled, and cross-platform."
663,What is the purpose of NuGet packages in .NET Core?,NuGet packages in .NET Core provide additional functionality and libraries that can be easily integrated into a project.
664,How does .NET Core enable faster and easier development?,.NET Core enables faster and easier development through its command line tools and flexible deployment strategies.
665,What types of applications can be built using .NET Core?,".NET Core can be used to build cloud-based internet connected applications such as Web apps, IoT apps, and mobile back ends."
666,What services does Cazton offer for .NET Core development?,"Cazton offers excellent .NET Core Consulting and .NET Core Training services for designing and developing scalable, robust, customizable, and flexible solutions."
667,What is ASP.NET Core and how does it relate to .NET Core?,ASP.NET Core is a web framework that is built on top of .NET Core and provides a leaner version of the ASP.NET Framework.
668,What is the difference between ASP.NET Core and ASP.NET Framework?,ASP.NET Core differs from the ASP.NET Framework by being a more lightweight and modular framework.
669,How can I learn more about Cazton's .NET Core consulting services?,You can learn more about Cazton's .NET Core consulting services by contacting them directly.
670,What are some code editors that can be used with .NET?,Some code editors that can be used with .NET are Visual Studio and Visual Studio Code.
671,What are the benefits of using .NET for application development?,".NET allows developers to develop scalable, flexible, testable, and secure applications."
672,What is the expertise of Cazton in Microsoft .NET?,Cazton has expertise in Microsoft .NET consulting.
673,What is .NET Standard?,.NET Standard is a set of formal API specifications that are implemented by all .NET Frameworks.
674,Who are the Microsoft Most Valuable Professionals in Cazton's team?,Cazton's team consists of Microsoft Most Valuable Professionals awarded by Microsoft .NET team.
675,When was the first version of .NET Framework released?,The first version of .NET Framework was released in the year 2002.
676,What is the purpose of the recently released .NET framework?,The recently released .NET framework is called .NET 8.
677,What is the expertise of Cazton's Microsoft practice?,"Cazton's Microsoft practice is heavily involved in open source projects and develops ASP.NET Web Applications, Cloud-based Applications, Mobile Applications, IOT Applications, Mixed Reality Apps, and more."
678,What types of applications can be developed using .NET?,"Various types of applications can be developed using .NET, including APIs, Web, Mobile, Desktop, IOT, Mixed Reality, and Cloud solutions."
679,What is the involvement of Cazton's Microsoft practice in open source projects?,Cazton's Microsoft practice is involved in open source projects.
680,What are Blazor Consulting services?,Blazor Consulting services are provided by Cazton.
681,What can go wrong with a Blazor upgrade?,"There are various things that can go wrong with a Blazor upgrade, even if you are skilled in JavaScript or C# and .NET based applications."
682,What are the benefits of using dependency injection in Blazor components?,Using dependency injection in Blazor components allows developers to easily inject services and perform dynamic operations or unit testing.
683,How can developers manage state in Blazor Server apps?,Blazor Server apps are stateful and offer capabilities to persist state in the server memory. Blazor WebAssembly developers can use client-side state management techniques using query strings.
684,How does Blazor make it easier for developers to create web UI components?,"Blazor allows developers to create reusable custom web UI components using C# and Razor syntax, making it easier to build web applications."
685,What technologies and frameworks can be used with Blazor?,"Blazor can be used with various web technologies and frameworks including HTML, CSS, JavaScript, Angular, React, and Vue."
686,What is Blazor and what can it be used for?,Blazor is an open source framework that can be used to build static websites or PWAs with offline capabilities.
687,What is the difference between Blazor WebAssembly and Blazor Server?,Blazor WebAssembly runs in all modern browsers that support WebAssembly and is expected to be shipped in mid-2020. Blazor Server executes the app on the server and handles UI updates over a real-time connection with the server using SignalR.
688,How does Cazton help companies with Blazor development?,Cazton helps companies with .NET development and offers expertise in Blazor development.
689,What is Cazton's approach to using WebAssembly in applications?,Cazton's approach is to use expert tools to make Blazor applications perform fast and scale well until WebAssembly matures to a point where there is no JavaScript.
690,What are progressive web apps?,Progressive web apps are web applications that can appear and function like traditional or native mobile apps.
691,What services does Cazton provide for progressive web apps?,"Cazton provides services for developing custom progressive web apps, analyzing website adaptability to PWA standards, migrating existing apps to feature-rich PWAs, and consulting on progressive web design and application shell architecture."
692,What are the benefits of using progressive web apps?,"Benefits of using progressive web apps include improved engagement rates, lower data usage, and the ability to work well on slow data connections."
693,How do push notifications work in progressive web apps?,Push notifications in PWAs are now a reality and are fairly simple to implement on mobile websites.
694,How easy is it to update a progressive web app?,"Updating a progressive web app is easier compared to updating a native app, as changes can be published and implemented without waiting for app store approval."
695,What is the size difference between a progressive web app and a native app?,"Progressive web apps are significantly smaller in size compared to native apps, with examples like Twitter Lite being 500-600KB compared to the main Twitter app's 25MB."
696,What technologies are used in progressive web app development?,"Technologies used in progressive web app development include SQL Server, PostGres, Azure Cosmos DB, MongoDB, Cassandra, Redis, Apache Ignite, .NET, Java, React, React Native, Ionic, Angular, Blazor, Swift, ASP.NET Core, Node.js, Electron.js, EF Core, and TypeScript."
697,What is the difference between progressive web apps and native apps?,Progressive web apps differ from native apps in that they are web pages or websites that can appear and function like native apps.
698,What are some features of progressive web apps?,"Features of progressive web apps include the ability to add to the home screen, push notifications, offline mode support, and search engine friendliness."
699,What services does Cazton offer for progressive web app development?,"Cazton offers services for progressive web app development, consulting, recruiting, and hands-on training."
700,What services does Cazton offer for Angular consulting?,Cazton offers excellent Angular Consulting and Angular Training services.
701,What are the benefits of using Angular?,Angular can be reused on any platform and allows for code reuse and smart loading.
702,How does Angular handle separation of concerns?,Angular follows a Model-View-Controller (MVC) pattern with separation of concerns.
703,What backends can be used with Angular?,"Angular can be used with backends such as Node.js, .NET Core, Java, .NET, and Python."
704,What are some interesting facts about Angular?,Angular is one of the fastest Single Page App (SPA) frameworks and has regular version releases.
705,How does Angular facilitate unit testing and end to end testing?,Angular provides standardized unit and end to end testing capabilities.
706,Can you provide an example of a successful project using Angular?,"Cazton has worked on successful projects involving Angular, including upgrading applications from AngularJS to Angular."
707,What is the significance of code optimization in Angular?,Code optimization is important in Angular to improve performance and maintainability.
708,What is the expertise of the Angular professionals at Cazton?,The Angular professionals at Cazton are experienced and certified Google Developer Experts.
709,What types of applications can be developed using Angular?,"Angular can be used to develop scalable, robust, customizable, and flexible applications."
710,What services does Cazton offer for React consulting?,Cazton offers React Consulting and Training services.
711,What is the motivation behind developing React?,The motivation behind developing React was slow methods of updating already existent HTML.
712,What does React Native use instead of HTML?,React Native uses alternative components instead of HTML.
713,How does React make websites more maintainable and extensible?,"React's component-based nature encourages code reusability, making websites more maintainable and extensible."
714,What are the advantages of using React for web development?,"The advantages of using React for web development include high performance, modularity, speed of development, code-reuse, cross-platform support, reduced complexity, and a great ecosystem."
715,Why was React developed by Facebook?,React was developed by Facebook to manage Facebook Ads more efficiently and deal with a large number of updates.
716,What concept does React implement to improve performance?,React implements the concept of Virtual DOM to enhance performance.
717,What services does Cazton provide for React development?,"Cazton provides React development, consulting, recruiting services, and hands-on training services."
718,What is React?,React is a Web 2.0 SPA (single-page app framework) open sourced by Facebook.
719,Why did Facebook develop React?,Facebook developed React because DOM is slow to work with and they needed a solution for managing large volumes of code.
720,Which domains does Cazton have expertise in?,"Cazton has expertise in different domains, including healthcare, insurance, finance, tech, entertainment, retail, and energy."
721,How long has Cazton worked directly with Microsoft product teams?,Cazton has worked directly with Microsoft product teams for almost a decade.
722,What is the Jedi contract for Azure?,The $10 Billion Jedi contract is for Azure.
723,What is the language of the text?,The language of the text is English.
724,What is Polyglot Persistence?,Polyglot Persistence refers to the practice of using multiple different database technologies that are complementary to each other in order to create highly scalable and efficient systems.
725,What are the benefits of Polyglot Persistence?,"The benefits of Polyglot Persistence include high scalability, high performance, cost-effectiveness, and the ability to use different database technologies that are best suited for specific tasks."
726,What is the recommended reading material for understanding Polyglot Persistence?,"The recommended reading material for understanding Polyglot Persistence is Scalability Patterns, which is written in a way that can be understood by both technical and non-technical individuals."
727,What services does Cazton offer in relation to Polyglot Persistence?,"Cazton offers Polyglot Persistence services and can help with setting up database infrastructure, improving database performance, and making the right decisions to achieve business goals."
728,What expertise does the team at Cazton have in database technologies?,"The team at Cazton has expertise in all database technologies, whether on-prem or cloud, and includes Developers, Consultants, Architects, Big Data Specialists, ML Experts, Data Scientists, Data Analysts, and more."
729,What is the role of graph databases in Polyglot Persistence?,Graph databases play a role in Polyglot Persistence by representing complex related data as graphs and allowing for analysis of relationships between data.
730,What is the role of search engine technologies in Polyglot Persistence?,"Search engine technologies, such as Apache Solr, are used in Polyglot Persistence to make data easily searchable. Apache Solr is a powerful search engine technology built on top of Lucene, and it is enterprise-ready, fast, and highly scalable."
731,What is Apache Solr and its features?,"Apache Solr offers features such as high performance, fault tolerance, and scalability. However, it should not be used as the primary source for persisting data."
732,What are the limitations of search engine databases?,"The limitations of search engine databases, like Apache Solr, are that they are more focused on making data easily searchable rather than being the primary source for persisting data."
733,What are some services offered by Cazton for SQL Server?,"Cazton offers SQL Server consulting, development, training, deployment, monitoring, troubleshooting, security implementation, and support services."
734,What are some scenarios that Cazton deals with on a daily basis?,Cazton deals with scenarios such as server code with more than 50 joins in a query and retrieving millions of records from SQL Server to the web server.
735,What are some benefits of using SQL Server 2019?,SQL Server 2019 can be used in almost any development environment and offers native drivers and interfaces for different programming languages.
736,What programming languages can be used with SQL Server?,"SQL Server can be used with .NET languages, Java, R, Python, Ruby, PHP, and more."
