,questions,answers
236,What are some of the advantages of using Databricks for processing unstructured data?,"Using Databricks for processing unstructured data offers advantages such as recent advances in processing audio, video, image, and text data, making the data strategy more efficient, reducing delays and errors, and increasing competitiveness."
237,What is Apache Hadoop?,"Apache Hadoop is a highly scalable open-source framework that allows processing and storage of petabytes of data. It enables fast, flexible and foolproof distributed file system with scalability and advanced data analytics."
238,What are the modules of Apache Hadoop's architecture?,"The modules of Apache Hadoop's architecture are Hadoop Common, Hadoop YARN, Hadoop Distributed File System commonly known as HDFS."
239,What is Hadoop Distributed File System (HDFS)?,Hadoop Distributed File System (HDFS) is the primary storage system used by Hadoop applications. It is based upon master/slave architecture where one master machine controls one or multiple slave devices and provides high performance access to large data.
240,What are some technologies included in Hadoop's ecosystem?,"Some technologies included in Hadoop's ecosystem are Spark, HIVE, Kafka, Impala, PIG, HBase, Zookeeper, Ambari, and Cassandra."
241,What are the benefits of using Apache Hadoop?,"The benefits of using Apache Hadoop include scalability, fast and flexible processing and storage of large datasets, cost-effectiveness compared to traditional storage systems, and enabling advanced data analysis."
242,How does Hadoop store and replicate data?,Hadoop stores data by creating replicas and storing them at multiple locations on different servers. This ensures data remains intact even if one node fails.
243,What is the role of HBase in Hadoop?,HBase is a non-relational database built on top of the Hadoop file system. It provides random real-time read/write access to data and leverages the fault-tolerance provided by HDFS.
244,What is the purpose of Zookeeper in Hadoop?,"Zookeeper is a centralized service in Hadoop that maintains configuration information, provides distributed synchronization, and group services to a large set of hosts."
245,What services does Cazton provide related to Hadoop?,"Cazton provides Hadoop development, consulting, recruiting services, and hands-on training services."
246,How does Hadoop enable scalability?,"Hadoop enables scalability by allowing big data to be stored across a cluster of one to hundreds of inexpensive servers, making it a better and less expensive solution compared to traditional relational databases."
247,What is Kafka?,Kafka is an open-source distributed event streaming platform designed to handle massive amounts of data in real time.
248,Who developed Kafka?,Kafka was initially developed by LinkedIn and later open-sourced as a part of the Apache Software Foundation.
249,What is the purpose of Kafka?,"The purpose of Kafka is to handle high volumes of data streams across multiple sources, making it a central component in managing data pipelines and real-time applications."
250,What are the services offered by Cazton for Kafka?,"Cazton offers Kafka consulting services, including guidance for big data streaming and processing requirements, stream management and processing best practices, administrating on-premise Kafka platform, and managing Kafka clusters on Windows, Linux, and cloud."
251,What is Kafka Raft (KRaft)?,Kafka Raft (KRaft) is not mentioned in the given text.
252,What is Confluent Cloud?,"Confluent Cloud is a fully managed cloud-based service offering Kafka-as-a-Service, allowing users to deploy Kafka clusters without the overhead of managing infrastructure."
253,What are the core concepts of Apache Kafka?,"The core concepts of Apache Kafka include a complex yet efficient architecture founded on several core elements, each playing a pivotal role in its operation."
254,What are the services offered by Cazton related to Kafka?,"Cazton offers services related to Apache Kafka, such as architecture design, installation and configuration, migration services, integration with existing systems and applications, and custom development of Kafka applications and extensions."
255,What are the benefits of using Kafka?,"The benefits of using Kafka include enhanced efficiency, scalability, and reliability, a streamlined and self-reliant architecture, and smoother, more resilient data processing and management."
256,What expertise do Kafka experts at Cazton have?,"Kafka experts at Cazton have strong analytical prowess and adept problem-solving capabilities, with expertise spanning across a wide array of programming languages."
257,What are the high level Spark APIs exposed for .NET developers?,"The high level Spark APIs exposed for .NET developers cover different features of Spark including Spark SQL, DataFrames, Streaming, and MLLib."
258,What can applications written in C# or F# on .NET platform do with Spark?,Applications written in C# or F# on .NET platform can easily integrate and leverage Spark's features to create revolutionary Big Data solutions on premise or on cloud.
259,What services does Cazton offer for Spark.NET consulting?,"Cazton offers Spark.NET consulting services to help with Big Data analytics, machine learning, and large scale data processing with Spark on .NET platform."
260,What is MMLSpark?,"MMLSpark stands for Microsoft Machine Learning library for Apache Spark, which is an open source library built on top of SparkML to address difficulties faced by Data Scientists in low level operations."
261,What is Azure HDInsight with Spark?,"Azure HDInsight with Spark is a platform-as-a-service (PAAS) that allows users to process huge amounts of data and develop, train, and deploy models on that data."
262,What is Azure Databricks?,"Azure Databricks is a Spark based analytics platform optimized for Azure, providing one-click setup-fully managed spark clusters, streamlined workflows, and an interactive workspace for collaboration between data scientists, data engineers, and business analysts."
263,What platforms does Spark.NET run on?,"Spark.NET runs on Windows, Linux, and macOS using .NET Core, or Windows using .NET Framework. It also runs on major cloud platforms."
264,What are the advantages of using Spark?,"The advantages of using Spark include lightning fast processing speed, batch and stream data processing, support for a variety of data sources, and easy integration with applications written in C#, Java, Scala, Python, and R."
265,What features of Spark are exposed for .NET developers?,"The features of Spark exposed for .NET developers include Spark SQL, DataFrames, Streaming, and MLLib."
266,Who is part of the team at Cazton that works on Spark.NET?,"The team at Cazton that works on Spark.NET includes a Microsoft Regional Director, Microsoft Most Valuable Professional, and Azure Insiders who work closely with the team that creates Spark.NET at Microsoft."
267,What services does Cazton offer for Azure Cosmos DB?,Cazton offers Cosmos DB Consulting and Training services at affordable rates. They provide solutions for performance and scalability issues.
268,What is the Strong consistency level in Cosmos DB?,"The Strong consistency level in Cosmos DB guarantees that each client request retrieves the most recently acknowledged write. However, it requires the Cosmos DB account to be associated with only one region."
269,What did the CEO demonstrate during the Microsoft Visual Studio Launch Event?,The CEO demonstrated CRUD operations utilizing Cosmos DB in conjunction with .NET and Node.js during the Microsoft Visual Studio Launch Event. He also emphasized the importance of proper data modeling and partitioning.
270,What is the multi-model database capability of Azure Cosmos DB?,"Azure Cosmos DB is a multi-model database that supports multiple database engines within a unified framework. It can store data in various formats such as key-value pairs, documents, column-family structures, or graphs."
271,What support does Cazton provide for leveraging Azure Cosmos DB's vector database and search functionalities?,"Cazton provides support for leveraging Azure Cosmos DB's vector database and search functionalities. They offer services for designing optimized architectures, integrating AI solutions, and fine-tuning performance for efficient indexing and retrieval of high-dimensional data."
272,What outcomes have been achieved using Cosmos DB according to Cazton?,Cazton has achieved exceptional levels of performance and scalability using Cosmos DB. They have delivered incredible results with write queries as low as 11ms and read queries as low as 8ms.
273,What APIs does Azure Cosmos DB support?,"Azure Cosmos DB supports multiple APIs including NoSQL, MongoDB, Cassandra, Gremlin, Table Storage, and PostgreSQL."
274,What is the difference between Cosmos DB and MongoDB?,"Cosmos DB and MongoDB are both database systems, but Cosmos DB offers a multi-model approach and supports multiple APIs, while MongoDB is a specific NoSQL database."
275,What is the Azure Cosmos DB free tier?,The Azure Cosmos DB free tier is a limited version of Cosmos DB that allows users to try out the service for free with certain limitations on storage and throughput.
276,What is Azure Cosmos DB's role as a Vector Database?,"Azure Cosmos DB can be used as a Vector Database, offering vector storage and search functionalities."
277,What programming languages and technologies are used for analyzing Big Data?,"Programming languages and technologies such as Python and R, as well as tools like Jupyter Notebook, are used for analyzing Big Data."
278,How can businesses benefit from harnessing the power of Big Data?,"By harnessing the power of Big Data, businesses can gain valuable insights, improve decision-making processes, and unlock new opportunities for innovation and growth."
279,What tools are utilized by Cazton for data visualization?,"Cazton utilizes data visualization tools such as Tableau, Power BI, and QlikView for uncovering patterns and correlations within large datasets."
280,What types of data does Big Data encompass?,"Big Data encompasses structured data (e.g., relational databases), semi-structured data (e.g., XML, JSON), and unstructured data (e.g., text, images, videos)."
281,How can one contact Cazton for more information about their Big Data consulting services?,"To contact Cazton for more information about their Big Data consulting services, one can reach out to them through their website."
282,What does Microsoft Fabric offer for AI and ML applications?,Microsoft Fabric provides a powerful foundation for AI and ML applications.
283,What are the capabilities of Microsoft Fabric?,Microsoft Fabric offers a comprehensive and streamlined solution with diverse analytics workloads and users.
284,What are the advantages of using Apache Spark?,"The advantages of using Apache Spark include fast processing speeds, ease of use, fault tolerance, near real-time processing, and integration with Hadoop and its ecosystem."
285,How many companies used Spark in production according to a survey in 2016?,"According to a survey done in 2016, more than 1,000 companies used Spark in production."
286,What is Spark Streaming and what sources can it ingest data from?,"Spark Streaming is a scalable, high-throughput, and fault-tolerant stream processing engine that can ingest data from sources like Kafka, Apache Flume, Amazon Kinesis, or TCP sockets."
287,What types of data sources can be loaded into Spark?,"Users can load data into Spark through JSON, CSV, and Text files, as well as databases via JDBC."
288,What is the main engine and most important component in Spark's ecosystem?,The main engine and most important component in Spark's ecosystem is Spark Core.
289,Which programming languages are supported by Spark?,"Spark supports programming languages like Scala, Java, Python, and R."
290,What services does Cazton offer for Apache Spark and Databricks?,"Cazton offers Databricks consulting services, including development, consulting, recruiting, and training services."
291,What is a data lakehouse and how does it differ from a data lake?,"A data lakehouse is a new architecture that combines the best elements of data lakes and data warehouses. It addresses the limitations of data lakes and includes analytics, real-time monitoring, data science, and machine learning capabilities."
292,What are some of the tools and technologies compatible with Databricks?,"Databricks is compatible with tools and technologies such as Kafka, Sqoop, Scala, Zookeeper, Parquet, ELK Stack, Tableau, Power BI, QlikView, R, Apache Ignite, Apache Beam, and Flink."
293,What was the annualized revenue of Databricks in 2022?,The annualized revenue of Databricks in 2022 was over $1 billion.
294,What is the purpose of Delta Lake in Databricks?,Delta Lake is used in Databricks for governance and compliance purposes. It uses mutual exclusion and optimistic concurrency to serialize commits and allow multiple users to access the data simultaneously.
295,What is the technique used to allow multiple users to access Delta Lake simultaneously?,"Delta Lake uses optimistic concurrency, a technique that allows multiple users to access the data simultaneously while ensuring data consistency and integrity."
296,What are the benefits of Apache Hadoop?,"The benefits of Apache Hadoop include fast, flexible, and foolproof distributed file system, scalability, and advanced data analytics."
297,How does Hadoop handle large datasets?,"Hadoop handles large datasets by providing fast, flexible, and foolproof distributed file system with scalability and advanced data analytics."
298,What are some other technologies in Hadoop's ecosystem?,"Some other technologies in Hadoop's ecosystem are Solr, Flume, Mahout, Avro, Sqoop, and Oozie."
299,What is the scalability of Hadoop?,Hadoop can scale from one server to hundreds of servers and still perform well.
300,What is HBase?,"HBase is a non-relational database modeled, distributed column-oriented database built on top of the Hadoop file system."
301,What is Zookeeper?,"Zookeeper is a centralized service for maintaining configuration information, naming, providing distributed synchronization, and group services to a large set of hosts."
302,What services does Cazton provide for Kafka?,"Cazton provides expert guidance for big data streaming and processing requirements, including administrating on-premise Kafka platforms, managing Kafka clusters on Windows, Linux, and cloud, and implementing access control measures and encryption protocols for Kafka clusters."
303,How can Cazton help with Kafka consulting?,"Cazton can help with Kafka consulting by providing expert guidance, best practices for stream management and processing, and experience in administrating on-premise Kafka platforms and managing Kafka clusters on Windows, Linux, and cloud."
304,What are some of the core concepts of Apache Kafka?,"Some of the core concepts of Apache Kafka include architecture design, installation and configuration, migration services, integration with existing systems and applications, and custom development of Kafka applications and extensions."
305,What are some of the services provided by Kafka consulting?,"Some of the services provided by Kafka consulting include architecture design, installation and configuration, migration services, integration with existing systems and applications, and custom development of Kafka applications and extensions."
306,How does Kafka integrate with existing systems and applications?,"Kafka can be integrated with existing systems and applications through various methods such as APIs, connectors, and custom development."
307,What are the high level Spark APIs available for .NET developers?,"The high level Spark APIs available for .NET developers cover different features of Spark including Spark SQL, DataFrames, Streaming, and MLLib."
308,Who has access to the source code of Spark.NET before its release?,Cazton's CEO was a part of the Spark.NET Project and had access to the source code before its release.
309,What does the video showcase about a Chat bot?,"The video showcases a cutting-edge Chat bot that is designed specifically for private enterprise data, with added role-based security and customizable features."
310,What is MMLSpark and what difficulties does it address?,"MMLSpark is Microsoft Machine Learning library for Apache Spark, which addresses difficulties faced by Data Scientists in low level operations like support for image processing and text."
311,What are some other technologies related to Big Data and AI?,"Other technologies related to Big Data and AI include AI Express PoC Service, OpenAI, Azure OpenAI, PyTorch, Microsoft Fabric, TensorFlow, Databricks, Apache Spark, Hadoop & HDFS, Apache Kafka, and more."
312,What is Azure Databricks and what are its features?,"Azure Databricks is a Spark based analytics platform optimized for Azure, providing one-click setup of fully managed spark clusters, streamlined workflows, and an interactive workspace for collaboration between data scientists, data engineers, and business analysts."
313,What outcomes have been achieved using Cosmos DB?,"Using Cosmos DB, Cazton has achieved exceptional levels of performance and scalability. They have delivered incredible results with write queries as low as 11ms and read queries as low as 8ms."
314,What APIs are supported by Azure Cosmos DB?,"Azure Cosmos DB supports multiple APIs, including NoSQL, MongoDB, Cassandra, Gremlin, Table Storage, and PostgreSQL."
315,What does Cazton offer in terms of Azure Cosmos DB consulting?,"Cazton offers comprehensive support for Azure Cosmos DB, including consulting, training, ongoing support, and custom application development tailored to specific business needs."
316,What is Cazton's partnership status with Microsoft Azure Cosmos DB?,Cazton is proud to be one of the few Microsoft Azure Cosmos DB preferred partners worldwide.
317,What services does Cazton offer for Cassandra consulting?,"Cazton offers various services for Cassandra consulting including integrating Cassandra with other Big Data technologies, scaling Cassandra clusters, monitoring and managing Cassandra clusters, setting up Cassandra data models, working with third-party libraries and plugins, helping with application development, deploying Cassandra on-prem or on a preferred cloud service, fixing database related issues, automating deployments, performing upgrading and data migration, mentoring teams, optimizing existing clusters, troubleshooting and fine-tuning performance, providing hardware recommendations, and offering custom Cassandra training."
318,How does Cassandra distribute tokens in a cluster?,"Cassandra distributes tokens in a cluster by using a partitioner, which is a hashing function that generates tokens from a primary key. Each row of data is uniquely identified by a primary key, and the partitioner generates tokens for all the data. Depending on the number of nodes in the cluster, these tokens are divided into an equal range of tokens."
319,What is the architecture of Cassandra?,Cassandra has a distributed architecture where each node is connected in a ring form. The nodes gossip to keep data consistent across all connected nodes. This architecture offers high availability and there is no single point of failure.
320,What is the compaction process in Cassandra?,"The compaction process in Cassandra involves reading data from all SSTable files and adding them into a new Memtable. It applies a merge sort and picks the last updated information based on the latest timestamp. Once the merge operation is completed, it writes all the latest data into a new SSTable file and deletes the old ones."
321,Who created Cassandra and when was it open-sourced?,Cassandra was created by Facebook to solve their data related problems and later open-sourced under Apache's license. It gained a lot of interest and was ranked as one of the top 10 NoSQL databases.
322,What is the primary language used to communicate with Cassandra?,"The primary language used to communicate with Cassandra is Cassandra Query Language (CQL). Developers can use the CQLSH command line shell to query Cassandra and perform various operations such as creating keyspaces, tables, indexes, inserting data, and more."
323,How does Cassandra ensure high availability?,"Cassandra ensures high availability by having no single point of failure. If any node fails, another node responds to the user's request. This is due to the distributed nature of Cassandra and its ring-based architecture."
324,What is the elastic scalability feature of Cassandra?,Cassandra offers elastic scalability by allowing its clusters to be scaled to thousands of commodity servers spread across multiple datacenters. It is designed for distributed systems and can handle large amounts of data.
325,What services does Cazton provide for Cassandra infrastructure and performance?,"Cazton provides various services for Cassandra infrastructure and performance including mentoring teams with best practices, optimizing existing clusters, troubleshooting and fine-tuning performance issues, providing hardware recommendations, and offering custom Cassandra training from beginner to advanced level."
326,What expertise does Cazton have in tackling data problems?,Cazton has expertise in understanding requirements and tackling data problems related to Cassandra. Clients trust them to provide solutions for their data problems.
327,Who offers Polyglot Persistence services?,Polyglot Persistence services are offered by Cazton.
328,What is recommended for understanding Polyglot Persistence?,"For understanding Polyglot Persistence, it is recommended to read Scalability Patterns, which is written in a way that anyone can understand."
329,What technologies are used in creating highly scalable systems with high performance?,Technologies used in creating highly scalable systems with high performance include multiple different database technologies that are complementary to each other.
330,What is the role of Cazton in Polyglot Persistence?,"Cazton is a team of expert Developers, Consultants, Architects, Big Data Specialists, Big Data Architects, ML Experts, Data Scientists, Data Analysts & Researchers, Predictive Modelers, Statisticians, Business Intelligence & Security Experts, and DBAs who understand the changing requirements and demands of the industry and have expertise in all database technologies."
331,What is Neo4j?,"Neo4j is an open-source, NoSQL, native graph database widely used in the industry. It allows for a flexible data model, real-time data analysis, high availability, scalability, and security."
332,What is Apache Solr?,"Apache Solr is a powerful search engine technology built on top of Lucene. It is enterprise-ready, fast, highly scalable, and primarily used for search."
333,What other database technologies are offered by Cazton?,"Cazton offers other database technologies such as SQL Server, PostGres, Azure Cosmos DB, MongoDB, Cassandra, Redis, Apache Ignite, and more."
334,What is MongoDB?,MongoDB is a NoSQL distributed document-based database that stores data as key-value pairs and can be scaled horizontally across multiple nodes in a cluster.
335,What are the features of MongoDB?,"The features of MongoDB include schema-free data storage, support for ACID transactions, ad hoc queries, joins, indexing, and more."
336,How does MongoDB store data?,"MongoDB stores data as a set of key-value pairs in a JSON-like document format, which allows for flexible and dynamic schemas."
337,What are the SQL features offered by MongoDB?,"MongoDB offers SQL features like ACID transactions, ad hoc queries, joins, and indexing."
338,What services does Cazton offer for MongoDB?,"Cazton offers MongoDB consulting and training services, including developing scalable solutions, migrating apps to MongoDB, and managing MongoDB on-premise and on leading cloud platforms."
339,How does MongoDB handle failures?,"In case of failures, MongoDB stops accepting writes until it can safely complete a consistent write operation. It allows reading data from secondary nodes until a primary node is elected."
340,Can MongoDB send custom alerts?,"Yes, MongoDB can send custom alerts in case a MongoDB instance is affected."
341,What are the storage engines offered by MongoDB?,"MongoDB offers multiple storage engines like WiredTiger, In-Memory, and MMAP (soon to be deprecated)."
342,Can MongoDB be used for in-memory processing?,"Yes, MongoDB offers in-memory processing using storage engines like WiredTiger and In-Memory."
343,What options are available for running MongoDB as a service?,"MongoDB can be run as a service using MongoDB Atlas or on any cloud platform like Google Cloud Platform, Azure, or AWS. It can also be installed as a service on local platforms."
344,What are some ready to use modules that can extend Redis data structures?,"RedisSearch, RedisGraph, RedisJSON, RedisTimeSeries, and RedisAI"
345,How does Redis enterprise offer features without affecting database performance?,By offering features without affecting database performance
346,What is the database latency for Redis?,Under one millisecond
347,What is the most durable persistence mechanism offered by Redis?,Append Only File (AOF)
348,What are atomic transactions in Redis?,Transactions in Redis that are atomic in nature and ensure all commands are executed or none
349,What are some use cases where Redis is not a good fit?,Using Redis for full-text search
350,What is the disadvantage of using Redis in-memory storage?,Chance of data loss if the machine storing data in memory loses power
351,What are some easy to implement commands offered by Redis for pub/sub models?,"PUBLISH, SUBSCRIBE, and UNSUBSCRIBE"
