,questions,answers
145, What are the benefits of having a good caching strategy for applications?,"
Do you have a good caching strategy for your applications? Have you felt the pain of sticky sessions? Have you had a caching strategy that didn't work for you? Do you need a caching strategy that scales seamlessly with the least amount of effort? If the answer to any of these questions is a ""yes,"" the good news is that you are in the right place.
"
146, What are the different data models that have emerged throughout the history of databases?,"
Database technologies have undergone several generations of evolution, right from flat-file systems to relational databases to schemaless databases. Some people might say that traditional relational databases are a thing of the past, but that is not true for all the scenarios. Changing requirements and evolution of the internet has meant that new types of databases have emerged, but most have specific use cases, which makes it difficult to decide on which database should be used when. At the same time, different types of data models have emerged throughout the history of databases but only Relational and NoSQL models have prevailed.
"
147, What is the typical job of someone who works with SQL Server code?,"
Have you ever encountered SQL Server code with more than 50 joins in a query? Have you ever seen code that retrieves millions of records SQL Server to the Web Server just to return one record to the User Interface? If yes, that's great. This is our daily job.
"
148,"
What research studies have consistently ranked PostGres as one of the top four relational databases?","
Did you know PostGres is the fastest growing relational database that is not only free and open source, but rivals the performance of paid RDBMS databases like Oracle and SQL Server? It is no surprise that PostGres has consistently ranked as one of the top four relational databases by multiple credible research studies comparing database engines.
"
149, What are the different types of NoSQL databases?,"
Did you know relational databases can scale up, but have a hard time scaling out? NoSQL databases, on the other hand, are meant to scale out with commodity-grade hardware. Many organizations prefer using NoSQL over SQL databases as it offers a great set of features. There are different types of NoSQL databases available including Key-Value Store, Document Databases, Column-Family Databases, Graph Databases and Full-Text Search Engine Databases.
"
150, What are the features of Cosmos DB that make it the next step forward in database technology?,"
The evolution of database technologies has been exceptional. Right from the first pre-stage flat-file systems to relational and object-relational databases to NoSQL databases, database technology has gone through several generations and its history has spread over more than 50 years now. A time has come when database technology has taken the next step forward to become more scalable, globally distributed and multi-model. Welcome to the new world of Cosmos DB!
"
151, What are some of the largest production deployments of Cassandra?,"
Did you know there are more than 1500 companies using Cassandra to handle huge volumes of data? Did you know that some of the largest production deployments include Apple's, with over 75,000 nodes storing over 10 PB of data, Netflix (2,500 nodes, 420 TB, over 1 trillion requests per day), Chinese search engine Easou (270 nodes, 300 TB, over 800 million requests per day), and eBay (over 100 nodes, 250 TB)?
"
152, What are the advantages of using Spark over Hadoop's MapReduce system?,"
Spark is an open-source, lightning fast, cluster computing framework that provides a fast and powerful engine for large-scale data (Big Data) processing. It runs programs up to 100x faster in-memory and 10x faster on disk when compared to Hadoop’s MapReduce system. The reason for Spark’s success is its ability to process data in-memory (using RAM) that allows faster retrieval of data as compared to querying and searching on disk.
"
153, What advantages does Spark provide for large scale data processing and Big Data analytics?,"
Over the years, Spark has seen great acceptance in the technology industry. When it comes to large scale data processing or Big Data analytics, Spark has gained a lot of attention due to its lightning fast processing speed, batch and stream data processing, support for a variety of data sources and easy to integrate with applications written in C#, Java, Scala, Python and R.
"
154," What techniques are used to manage, analyze, make predictions, and decisions using large amounts of data?","
With every passing second, the amount of data shared and transferred between humans is unimaginable. To manage, analyze, make predictions and decisions using that data is a daunting task. With data being a critical asset, companies today strive to understand the latest market trends, customer preferences and other requirements, thus making understanding large amount of data imperative.
"
155, What are the benefits of using a process to convert unstructured information into valuable insights in real time?,"
Imagine a process which converts unstructured, unreadable pieces of information into something that is extremely valuable for your organization? information that gives you insights about your business, your products, customers and their preferences. Now imagine getting those insights in real time! We are talking about a process that gives you instant information about an active transaction. Such information is always valuable, isn't it
"
156, What qualifications do Cazton's enterprise-level practitioners possess?,"At Cazton, we have experts who have decades of real-world hands-on experience of implementing enterprise-level software architectures and design patterns in a wide variety of software projects that are modular, maintainable, testable and futuristic. Our enterprise-level practice is led by a professionals who have been former Microsoft and Google employees, former IBMers and internationally-acclaimed speakers. Contact us now to learn more about our enterprise architecture and development services."
157, What are the important factors to consider when designing software architecture?,"
The term architecture generally means the practice of designing or building something. Software architecture is the process of taking operational and technical requirements, and designing a solution that optimizes things important to the system like quality, performance, security, and maintainability. If we envision what is needed to build software, it is similar to the process of constructing a building. In the latter, architects first start by selecting a site. It is then cleared by creating a solid foundation. Architects and workers then erect the building's core structure, build the floors, level by level; interconnect the entire building with wires and plumbing, and finally finish off the interior and exterior of the building.
"
158, What types of technologies are being adopted in different industries?,"
Since the evolution of a wide variety of devices, the volume of data being captured has grown. The IoT is emerging as a key enabler of our digital future, and global spending on IoT and Smart devices will increase tremendously in the next few years. There has been a widespread adoption of different types of technologies in industries like banking and investment services, education, healthcare, insurance, and many others.
"
159, What were the benefits of transitioning from monolith apps to services?,"
Transitioning from monolith apps to services was a logical progression. In order to have services or APIs that could communicate with external as well as internal systems, it made sense to take a particular component of the system and convert it into services.
"
160, What led Google to open source Kubernetes after 15 years of internal use?,"
Google used Kubernetes internally for about 15 years of experience before finally open sourcing it. As we can imagine Google probably has the highest production workload given that Google.com and Youtube.com are the two top websites in the world.
"
161, What challenges do enterprise software developers face on a daily basis?,"
In Enterprise software development we have a lot of challenges on a daily basis. We have different team members who have different strengths. UI developers might want to work on a Mac, while the backend developers might like to work in a Windows environment.
"
162, What are the benefits of using Node.js as a web development framework?,"
Did you know Node.js, a popular open-source web development framework, is one of the most adopted JavaScript runtimes? Did you know that Node.js runs the V8 JavaScript engine which is the core of Google Chrome? Node.js is async-first which makes it achieve hyper-scale with commodity level machines.
"
163, What advantages does .NET Core offer compared to the .NET Framework?,"
.NET Core is a fresh new software development framework that allows developers to create next generation apps with ease. It is Microsoft’s latest software development framework, which is cloud-enabled, cross-platform, modular and fast. It is a complete rewrite of the existing .NET framework. Unlike the .NET Framework, .NET Core is fully open-source, which means that the features of this framework directly reflect the skills and desires of .NET developers and the community.
"
164, What type of applications and solutions can be developed using Microsoft .NET?,"
Microsoft .NET is one of the most preferred and widely used technologies in the software development industry. It is a set of technologies that work together to solve different business problems. Over the years, this technological ecosystem has evolved extensively. It provides rich set of tools, libraries and APIs for developing different types of applications and solutions for Web, Mobile, Cloud, Desktop, Gaming, IOT, Mixed Reality and much more.
"
165,"
What versions of Angular are currently supported?","
Did you know Angular is one of the fastest Single Page App (SPA) frameworks? Did you know the Angular team has kept its promise of releasing a new version every six months? With enterprise clients upgrading from AngularJS to Angular recently, it’s been a great time for Cazton to help clients not only upgrade brownfield applications from AngularJS to Angular, but also develop greenfield applications on Angular (versions 2, 4, 5, 6 and now 7).
"
166, What advantages does Blazor offer over traditional JavaScript frameworks?,"
Are you tired of maintaining JavaScript code? Do you have performance issues with JavaScript? Blazor may be the answer to your problems. Did you know Blazor is based on existing web technologies like HTML and CSS, but allows using C# and Razor syntax instead of JavaScript to build composable web UIs? Welcome Blazor, the latest client-side framework from Microsoft that lets you run your client-side C# code directly in the browser.
"
167, What advantages does React offer in terms of maintainability and extensibility of websites?,"
Many times developers need to rewrite and change code when adding new components or features. React, with its component-based nature, makes this easy and encourages code reusability and hence makes websites much more maintainable and extensible. At Cazton, our team of JavaScript experts are well-versed with a wide variety of JavaScript frameworks including React and have years hands on experience building tools, libraries, applications using various JavaScript frameworks. 
"
168, What services does your team provide?,"
Have you worked with multi-billion dollar consulting and recruiting companies? If yes, we are sure we can provide more quality services at a much more affordable rates. We have been fortunate to work directly with Microsoft product teams for many years. Our team includes Microsoft awarded Most Valuable Professionals, Azure Insiders, Docker Insiders, ASP.NET Insiders, Web API Advisors, Cosmos DB Insiders as well as experts in other Microsoft and notable open source technologies.
"
169, What technologies has Microsoft contributed to the Web and open source?,"
The Web has seen significant transformation over the years. Beginning with the first static website, which released almost three decades ago to today when sophisticated technologies display real-time information, the transformation has been spectacular. Microsoft’s contribution to Web and open source has been especially noteworthy. This company has been one of the pioneers in providing great web development technologies through .NET. Technologies like ASP.NET Web Forms, ASP.NET MVC, SignalR, Web API, Entity Framework, SQL Server and their latest ASP.NET Core that supports .NET Core.
"
170, What are some of the ways JavaScript has been used in the tech industry?,"
It is no secret JavaScript has become insanely popular amongst developers. From backend engineering to building hybrid mobile apps and constructing cloud solutions, it has made its massive presence felt everywhere. Even the fields of machine learning and robotics started adopting the versatile JavaScript.
"
171, What are some of the problems that mobile app developers have faced in the past?,"
For the longest time, mobile application developers have had to learn and write code separately for the two mobile operating systems. To make an app available to everyone, you would have to write all the code twice: for iOS in Swift and for Android in Java. Mobile app developers have long been plagued by the problem of inefficiency, typically slow cycles of development, slow loading of applications and overall low productivity.
"
172,"
What do the acronyms DRY and Electron stand for in the context of software development?","
One of the principles of software development is DRY, which stands for “Do not Repeat Yourself.” Yet, ironically, developers needed to write logic again and again for various different platforms. React Native has now allowed the logic layer to be used amongst Android and iOS mobile applications. Electron is another pivotal achievement in that direction.
"
173, What strategies and practices do organizations use to achieve sustained growth?,"
Growth is the most important factor for any organization. To have a sustained growth, the organization has to follow certain rules and regulations, apply strategies and practices, and depend on technologies that help them manage their customers and customer information. By applying various logical, methodical and well-organized strategies, organizations try to convert high prospects and leads into loyal customers.
"
174, What services does Cazton offer to help integrate and adapt blockchain into existing networks?,"At Cazton, we provide first class Blockchain consulting and Blockchain training services. Our team of Blockchain Specialists, Blockchain Consultants and Developers can assess your business requirements and consult if blockchain suits as the perfect solution. While our experts help you develop the correct blockchain solution, we also help you adapt and integrate blockchain into your existing network, develop and deploy smart contracts, token creation, ICO auditing, perform smart contract audits, public and private blockchain creation, wallet security solutions, wallet integration, and much more. Contact us now to learn more about our cloud services."
175, What services does Cazton offer related to Blockchain?,"
Cazton offers first class Blockchain consulting and Blockchain training services where we assess your business requirements and consult if blockchain suits as the perfect solution. Our Blockchain Specialists, Blockchain Consultants and Developers can help you adapt and integrate blockchain, develop and deploy smart contracts, token creation, ICO auditing, perform smart contract audits, public and private blockchain creation, wallet security solutions, wallet integration, and much more.
"
176, What is Chander Dhall's background in computer science?,"
Our CEO, Chander Dhall, became fascinated with machine learning over a decade ago. Having a masters in computer science, he has always kept up with academia even though the company primarily works on projects for mid and large size Fortune 500 corporations. Having been awarded by both Microsoft (Microsoft Most Valuable Professional for close to a decade) and Google (Google Developer Expert), he has been fortunate to interact and share knowledge with the ones who create these technologies.
"
177, What inspired Chander Dhall to pursue a career in machine learning?,"
Our CEO, Chander Dhall, became fascinated with machine learning over a decade ago. Having a masters in computer science, he has always kept up with academia even though the company primarily works on projects for mid and large size Fortune 500 corporations.
"
178, What advantages does Spark have over Hadoop's MapReduce system?,"
Spark is an open-source, lightning fast, cluster computing framework that provides a fast and powerful engine for large-scale data (Big Data) processing. It runs programs up to 100x faster in-memory and 10x faster on disk when compared to Hadoop’s MapReduce system. The reason for Spark’s success is its ability to process data in-memory (using RAM) that allows faster retrieval of data as compared to querying and searching on disk.
"
179, What are the advantages of using Spark for Big Data analytics?,"
Over the years, Spark has seen great acceptance in the technology industry. When it comes to large scale data processing or Big Data analytics, Spark has gained a lot of attention due to its lightning fast processing speed, batch and stream data processing, support for a variety of data sources and easy to integrate with applications written in C#, Java, Scala, Python and R.
"
180, What challenges do companies face when trying to understand large amounts of data?,"
With every passing second, the amount of data shared and transferred between humans is unimaginable. To manage, analyze, make predictions and decisions using that data is a daunting task. With data being a critical asset, companies today strive to understand the latest market trends, customer preferences and other requirements, thus making understanding large amount of data imperative.
"
181, What are the advantages of using Apache™ Hadoop for Big Data processing?,"
Cazton has been a pioneer in Big Data Consulting and one popular technology that powers Big Data is Apache™ Hadoop. Hadoop is a highly scalable open-source framework written in Java, which allows processing and storage of terabytes or even petabytes of structured and unstructured complex data (Big Data) across clusters of computers. Its unique storage mechanism over distributed file system (HDFS) maps data wherever it is located on a cluster. The speciality of Hadoop is that it can scale from one server to hundreds of servers and can still perform well. It is fast, flexible and cost-effective as compared to traditional storage systems.
"
182, What is the value of gaining insights from unstructured and unreadable pieces of information in real time?,"
Imagine a process which converts unstructured, unreadable pieces of information into something that is extremely valuable for your organization? information that gives you insights about your business, your products, customers and their preferences. Now imagine getting those insights in real time! We are talking about a process that gives you instant information about an active transaction. Such information is always valuable, isn't it
"
183," Are you looking for a solution that enables scalability, atomic transactions, and faster processing times for machine learning models?","
Do you face problems while scaling data in memory? Are you facing slow processing times? Do you want scalability and as well as atomic transactions? Do your machine learning models require a lot of time for training and production?
"
184, What companies are currently using Cassandra to handle large volumes of data?,"
Did you know there are more than 1500 companies using Cassandra to handle huge volumes of data? Did you know that some of the largest production deployments include Apple's, with over 75,000 nodes storing over 10 PB of data, Netflix (2,500 nodes, 420 TB, over 1 trillion requests per day), Chinese search engine Easou (270 nodes, 300 TB, over 800 million requests per day), and eBay (over 100 nodes, 250 TB)?
"
185,"
What are the challenges you face when writing SQL Server code with more than 50 joins in a query?","
Have you ever encountered SQL Server code with more than 50 joins in a query? Have you ever seen code that retrieves millions of records SQL Server to the Web Server just to return one record to the User Interface? If yes, that's great. This is our daily job.
"
186,"
What research studies have consistently ranked PostGres as one of the top four relational databases?","
Did you know PostGres is the fastest growing relational database that is not only free and open source, but rivals the performance of paid RDBMS databases like Oracle and SQL Server? It is no surprise that PostGres has consistently ranked as one of the top four relational databases by multiple credible research studies comparing database engines.
"
187, What is the best caching strategy for applications that need to scale seamlessly?,"
Do you have a good caching strategy for your applications? Have you felt the pain of sticky sessions? Have you had a caching strategy that didn't work for you? Do you need a caching strategy that scales seamlessly with the least amount of effort? If the answer to any of these questions is a ""yes,"" the good news is that you are in the right place.
"
188, What are the different types of databases and data models that have been used throughout the history of databases?,"
Database technologies have undergone several generations of evolution, right from flat-file systems to relational databases to schemaless databases. Some people might say that traditional relational databases are a thing of the past, but that is not true for all the scenarios. Changing requirements and evolution of the internet has meant that new types of databases have emerged, but most have specific use cases, which makes it difficult to decide on which database should be used when. At the same time, different types of data models have emerged throughout the history of databases but only Relational and NoSQL models have prevailed.
"
189, What kind of experts does your team include?,"
Have you worked with multi-billion dollar consulting and recruiting companies? If yes, we are sure we can provide more quality services at a much more affordable rates. We have been fortunate to work directly with Microsoft product teams for many years. Our team includes Microsoft awarded Most Valuable Professionals, Azure Insiders, Docker Insiders, ASP.NET Insiders, Web API Advisors, Cosmos DB Insiders as well as experts in other Microsoft and notable open source technologies.
"
190, What best practices from a beginner to an advanced level will be covered in this workshop?,Are you building next-generation web apps? Do you want a framework that is faster than Node.js on I/O and computation both? Do you want scalability as well as performance? Everything you need to know about best practices from a beginner to an advanced level will be covered in this workshop.
191, What qualifications and experience do the experts on the team have in data science and machine learning?,"Our team consists of experts who not only have PhDs as well as masters’ degrees in data science and machine learning, they also have years of experience in the industry. That’s one reason our team has been working on serious machine learning projects long before any of our competitors. Machine learning projects require serious understanding of data."
192, What features of Spark does the Spark.NET Nuget package offer for .NET developers?,"Microsoft recently released Spark.NET, which is currently available as a Nuget package that runs not only on Windows, Linux, and macOS using .NET Core, or Windows using .NET Framework, but also on major cloud platforms. High- level Spark APIs that cover different features of Spark including Spark SQL, DataFrames, Streaming and MLLib are exposed for .NET developers."
193, What topics are covered in the microservices training offered by Cazton?,"Do you use the monolithic approach for developing your applications? Are you looking for more modularity and decentralization in your codebase? Have you heard companies like Amazon, Netflix and eBay have switched from a monolithic to microservices approach? Everything you need to know about microservices from a beginner to an advanced level will be covered in this training."
194, What topics will be covered in the in-depth hands-on training on Kubernetes?,"This is an in depth hands-on training on Kubernetes where you will learn about architectural design for deploying applications using Kubernetes, CI/CD Pipeline, using Kubernetes in the cloud, packaging and deploying applications in a Kubernetes Cluster and much more."
195, What topics are covered in the in-depth hands-on training on Docker?,"This is an in depth hands-on training on Docker where you will learn about Docker, Docker Compose, Containers and Virtualization, Image Repositories, Docker Compose Orchestration with VSCode Tasks, Optimized Multi-Stage Docker BuildsContinuous Deployment with Keel and WebHooks and much more."
